{
  "schemaVersion": 1,
  "name": "agent-workflow-release-readiness",
  "workflowVersion": "1.0.0",
  "mode": "read_only",
  "requiresActiveTask": "not_used",
  "allowedWrites": [],
  "commandClasses": ["read_repository", "read_git_state", "workflow_validate"],
  "stopConditions": ["external_authority_required", "proof_mismatch", "recovery_unproven", "state_invalid"]
}
